{
  "schema_version": "1.0.0",
  "request_id": "toolreq_01HZX8K7J2V3M4N5P6Q7R8S9T0",
  "tool_name": "analyze_audio",
  "requested_at": "2026-04-14T20:20:08Z",
  "session_id": "session_01HZX8J7J2V3M4N5P6Q7R8S9T0",
  "asset_id": "asset_01HZX8A7J2V3M4N5P6Q7R8S9T0",
  "version_id": "ver_01HZX8B7J2V3M4N5P6Q7R8S9T0",
  "caller": "llm-agent",
  "arguments": {
    "audio_version": {
      "schema_version": "1.0.0",
      "version_id": "ver_01HZX8B7J2V3M4N5P6Q7R8S9T0",
      "asset_id": "asset_01HZX8A7J2V3M4N5P6Q7R8S9T0",
      "lineage": {
        "created_at": "2026-04-14T20:20:05Z",
        "created_by": "modules/io",
        "reason": "initial import"
      },
      "audio": {
        "storage_ref": "storage/audio/ver_01HZX8B7J2V3M4N5P6Q7R8S9T0.wav",
        "sample_rate_hz": 44100,
        "channels": 2,
        "duration_seconds": 4,
        "frame_count": 176400,
        "channel_layout": "stereo"
      },
      "state": {
        "is_original": true,
        "is_preview": false
      }
    },
    "include_annotations": true,
    "include_segments": true,
    "include_source_character": true
  }
}
