{
  "schema_version": "1.0.0",
  "request_id": "toolreq_01HZZ0ANALYZEAUDIOREQ0000001",
  "tool_name": "analyze_audio",
  "requested_at": "2026-04-14T20:20:03Z",
  "session_id": "session_01HZZ0FIRSTSLICE0000000001",
  "asset_id": "asset_01HZZ0FIRSTSLICEASSET00000001",
  "version_id": "ver_01HZZ0FIRSTSLICEBASE00000001",
  "caller": "agent-a-contract-fixture-track",
  "arguments": {
    "audio_version": {
      "schema_version": "1.0.0",
      "version_id": "ver_01HZZ0FIRSTSLICEBASE00000001",
      "asset_id": "asset_01HZZ0FIRSTSLICEASSET00000001",
      "lineage": {
        "created_at": "2026-04-14T20:20:02Z",
        "created_by": "modules/io",
        "reason": "initial import"
      },
      "audio": {
        "storage_ref": "storage/audio/ver_01HZZ0FIRSTSLICEBASE00000001.wav",
        "sample_rate_hz": 44100,
        "channels": 2,
        "duration_seconds": 4,
        "frame_count": 176400,
        "channel_layout": "stereo"
      },
      "state": {
        "is_original": true,
        "is_preview": false
      }
    },
    "generated_at": "2026-04-14T20:20:04Z",
    "include_annotations": true,
    "include_segments": true,
    "include_source_character": true
  }
}
